{
  "schema_version": 1,
  "pipeline_version": "v6",
  "run_id": "daily-2026-07-21-20260721034748.-486aeae0",
  "date": "2026-07-21",
  "source": "huggingface",
  "generated_at": "2026-07-21T03:47:48.015Z",
  "items": [
    {
      "canonical_id": "huggingface:sentence-transformers/all-MiniLM-L6-v2",
      "promptHash": "sha256:8ca19d098c0d5ea46046da1c9f3b1a75106bb839b2c9e9dd8eef54e1c97f811a",
      "summary_version": 0,
      "status": "pending",
      "summary_short": {
        "zh": "",
        "en": "",
        "es": ""
      },
      "tri_context": {
        "name": "all-MiniLM-L6-v2",
        "url": "https://huggingface.co/sentence-transformers/all-MiniLM-L6-v2",
        "tags": [
          "sentence-transformers",
          "pytorch",
          "tf",
          "rust",
          "onnx",
          "safetensors",
          "openvino",
          "bert",
          "feature-extraction",
          "sentence-similarity",
          "transformers",
          "en",
          "dataset:s2orc",
          "dataset:flax-sentence-embeddings/stackexchange_xml",
          "dataset:ms_marco",
          "dataset:gooaq",
          "dataset:yahoo_answers_topics",
          "dataset:code_search_net",
          "dataset:search_qa",
          "dataset:eli5",
          "dataset:snli",
          "dataset:multi_nli",
          "dataset:wikihow",
          "dataset:natural_questions",
          "dataset:trivia_qa",
          "dataset:embedding-data/sentence-compression",
          "dataset:embedding-data/flickr30k-captions",
          "dataset:embedding-data/altlex",
          "dataset:embedding-data/simple-wiki",
          "dataset:embedding-data/QQP",
          "dataset:embedding-data/SPECTER",
          "dataset:embedding-data/PAQ_pairs",
          "dataset:embedding-data/WikiAnswers",
          "arxiv:1904.06472",
          "arxiv:2102.07033",
          "arxiv:2104.08727",
          "arxiv:1704.05179",
          "arxiv:1810.09305",
          "base_model:nreimers/MiniLM-L6-H384-uncased",
          "base_model:quantized:nreimers/MiniLM-L6-H384-uncased",
          "license:apache-2.0",
          "eval-results",
          "text-embeddings-inference",
          "endpoints_compatible",
          "deploy:azure",
          "region:us"
        ],
        "stats": {
          "downloads_total": 240643472,
          "likes_total": 5102
        },
        "metadata": {
          "license": "N/A",
          "lang": "N/A",
          "categories": {
            "capabilities": [],
            "scenes": [],
            "lifecycle": []
          }
        },
        "description": ""
      },
      "created_at": "2026-07-21T03:47:48.015Z",
      "updated_at": "2026-07-21T03:47:48.015Z"
    },
    {
      "canonical_id": "huggingface:cross-encoder/ms-marco-MiniLM-L6-v2",
      "promptHash": "sha256:e870990c5b3a25ae59fcf44e1245c0641a539ed34ccc7b8fa7795cfff5731ee3",
      "summary_version": 0,
      "status": "pending",
      "summary_short": {
        "zh": "",
        "en": "",
        "es": ""
      },
      "tri_context": {
        "name": "ms-marco-MiniLM-L6-v2",
        "url": "https://huggingface.co/cross-encoder/ms-marco-MiniLM-L6-v2",
        "tags": [
          "sentence-transformers",
          "pytorch",
          "jax",
          "onnx",
          "safetensors",
          "openvino",
          "bert",
          "text-classification",
          "transformers",
          "text-ranking",
          "en",
          "dataset:sentence-transformers/msmarco",
          "base_model:cross-encoder/ms-marco-MiniLM-L12-v2",
          "base_model:quantized:cross-encoder/ms-marco-MiniLM-L12-v2",
          "license:apache-2.0",
          "text-embeddings-inference",
          "endpoints_compatible",
          "region:us"
        ],
        "stats": {
          "downloads_total": 81260742,
          "likes_total": 287
        },
        "metadata": {
          "license": "N/A",
          "lang": "N/A",
          "categories": {
            "capabilities": [],
            "scenes": [],
            "lifecycle": []
          }
        },
        "description": ""
      },
      "created_at": "2026-07-21T03:47:48.015Z",
      "updated_at": "2026-07-21T03:47:48.015Z"
    },
    {
      "canonical_id": "huggingface:google-bert/bert-base-uncased",
      "promptHash": "sha256:103bf1cded07197c1a0c664f6dcb115c0d0822e3d00b7dfad50034a8b7a28f29",
      "summary_version": 0,
      "status": "pending",
      "summary_short": {
        "zh": "",
        "en": "",
        "es": ""
      },
      "tri_context": {
        "name": "bert-base-uncased",
        "url": "https://huggingface.co/google-bert/bert-base-uncased",
        "tags": [
          "transformers",
          "pytorch",
          "tf",
          "jax",
          "rust",
          "coreml",
          "onnx",
          "safetensors",
          "bert",
          "fill-mask",
          "exbert",
          "en",
          "dataset:bookcorpus",
          "dataset:wikipedia",
          "arxiv:1810.04805",
          "license:apache-2.0",
          "endpoints_compatible",
          "deploy:azure",
          "region:us"
        ],
        "stats": {
          "downloads_total": 76450882,
          "likes_total": 2712
        },
        "metadata": {
          "license": "N/A",
          "lang": "N/A",
          "categories": {
            "capabilities": [],
            "scenes": [],
            "lifecycle": []
          }
        },
        "description": ""
      },
      "created_at": "2026-07-21T03:47:48.015Z",
      "updated_at": "2026-07-21T03:47:48.015Z"
    },
    {
      "canonical_id": "huggingface:BAAI/bge-small-en-v1.5",
      "promptHash": "sha256:5ed6cb6fb5aa934e43677a957100253b7a8572eaddddcf9750de5c99dd45f1f3",
      "summary_version": 0,
      "status": "pending",
      "summary_short": {
        "zh": "",
        "en": "",
        "es": ""
      },
      "tri_context": {
        "name": "bge-small-en-v1.5",
        "url": "https://huggingface.co/BAAI/bge-small-en-v1.5",
        "tags": [
          "sentence-transformers",
          "pytorch",
          "onnx",
          "safetensors",
          "bert",
          "feature-extraction",
          "sentence-similarity",
          "transformers",
          "mteb",
          "en",
          "arxiv:2401.03462",
          "arxiv:2312.15503",
          "arxiv:2311.13534",
          "arxiv:2310.07554",
          "arxiv:2309.07597",
          "license:mit",
          "model-index",
          "text-embeddings-inference",
          "endpoints_compatible",
          "deploy:azure",
          "region:us"
        ],
        "stats": {
          "downloads_total": 62961873,
          "likes_total": 516
        },
        "metadata": {
          "license": "N/A",
          "lang": "N/A",
          "categories": {
            "capabilities": [],
            "scenes": [],
            "lifecycle": []
          }
        },
        "description": ""
      },
      "created_at": "2026-07-21T03:47:48.015Z",
      "updated_at": "2026-07-21T03:47:48.015Z"
    },
    {
      "canonical_id": "huggingface:google/electra-base-discriminator",
      "promptHash": "sha256:b7a35829f521c4fdcddf87805ac9f16ebd258cc548173cdfb983730156ddf6b9",
      "summary_version": 0,
      "status": "pending",
      "summary_short": {
        "zh": "",
        "en": "",
        "es": ""
      },
      "tri_context": {
        "name": "electra-base-discriminator",
        "url": "https://huggingface.co/google/electra-base-discriminator",
        "tags": [
          "transformers",
          "pytorch",
          "tf",
          "jax",
          "rust",
          "electra",
          "pretraining",
          "en",
          "arxiv:1406.2661",
          "license:apache-2.0",
          "endpoints_compatible",
          "region:us"
        ],
        "stats": {
          "downloads_total": 52202882,
          "likes_total": 144
        },
        "metadata": {
          "license": "N/A",
          "lang": "N/A",
          "categories": {
            "capabilities": [],
            "scenes": [],
            "lifecycle": []
          }
        },
        "description": ""
      },
      "created_at": "2026-07-21T03:47:48.015Z",
      "updated_at": "2026-07-21T03:47:48.015Z"
    }
  ]
}
