{
  "schema_version": 1,
  "pipeline_version": "v6",
  "run_id": "data-analysis-2026-04-22-20260422035516.-e146be1f",
  "date": "2026-04-22",
  "source": "github",
  "generated_at": "2026-04-22T03:55:16.323Z",
  "items": [
    {
      "canonical_id": "github:sindresorhus/awesome",
      "promptHash": "sha256:2724fb8aae725474927df4f6b45de69bae28d10fbcf1a45f9da35c228ebe25de",
      "summary_version": 0,
      "status": "pending",
      "summary_short": {
        "zh": "😎 Awesome lists about all kinds of interesting topics",
        "en": "😎 Awesome lists about all kinds of interesting topics",
        "es": ""
      },
      "tri_context": {
        "name": "awesome",
        "url": "https://github.com/sindresorhus/awesome",
        "tags": [
          "awesome",
          "awesome-list",
          "lists",
          "resources",
          "unicorns"
        ],
        "stats": {
          "stars": 457709,
          "forks": 34390,
          "issues": 65
        },
        "metadata": {
          "license": "CC0-1.0",
          "lang": "N/A",
          "categories": {
            "capabilities": [],
            "scenes": [],
            "lifecycle": []
          }
        }
      },
      "created_at": "2026-04-22T03:43:23.786Z",
      "updated_at": "2026-04-22T03:43:23.786Z"
    },
    {
      "canonical_id": "github:freeCodeCamp/freeCodeCamp",
      "promptHash": "sha256:7ce99892d88148e7d5cae0b4fc07936e1c16cb26ec455fb4ce856749a954c941",
      "summary_version": 0,
      "status": "pending",
      "summary_short": {
        "zh": "freeCodeCamp.org's open-source codebase and curriculum. Learn math, programming, and computer science for free.",
        "en": "freeCodeCamp.org's open-source codebase and curriculum. Learn math, programming, and computer science for free.",
        "es": ""
      },
      "tri_context": {
        "name": "freeCodeCamp",
        "url": "https://github.com/freeCodeCamp/freeCodeCamp",
        "tags": [
          "careers",
          "certification",
          "community",
          "curriculum",
          "d3",
          "education",
          "freecodecamp",
          "javascript",
          "learn-to-code",
          "math",
          "nodejs",
          "nonprofits",
          "programming",
          "react",
          "teachers"
        ],
        "stats": {
          "stars": 443335,
          "forks": 44358,
          "issues": 192
        },
        "metadata": {
          "license": "BSD-3-Clause",
          "lang": "TypeScript",
          "categories": {
            "capabilities": [],
            "scenes": [],
            "lifecycle": []
          }
        }
      },
      "created_at": "2026-04-22T03:43:23.786Z",
      "updated_at": "2026-04-22T03:43:23.786Z"
    },
    {
      "canonical_id": "github:public-apis/public-apis",
      "promptHash": "sha256:2f7e803145c8932a8d3a6af2351a8c66d6db19e0b3d661aba966423d3b32968f",
      "summary_version": 0,
      "status": "pending",
      "summary_short": {
        "zh": "A collective list of free APIs",
        "en": "A collective list of free APIs",
        "es": ""
      },
      "tri_context": {
        "name": "public-apis",
        "url": "https://github.com/public-apis/public-apis",
        "tags": [
          "api",
          "apis",
          "dataset",
          "development",
          "free",
          "list",
          "lists",
          "open-source",
          "public",
          "public-api",
          "public-apis",
          "resources",
          "software"
        ],
        "stats": {
          "stars": 425696,
          "forks": 46420,
          "issues": 1279
        },
        "metadata": {
          "license": "MIT",
          "lang": "Python",
          "categories": {
            "capabilities": [],
            "scenes": [],
            "lifecycle": []
          }
        }
      },
      "created_at": "2026-04-22T03:43:23.786Z",
      "updated_at": "2026-04-22T03:43:23.786Z"
    },
    {
      "canonical_id": "github:EbookFoundation/free-programming-books",
      "promptHash": "sha256:f498b06b6c0acc167c4862603584f4df565b0c479f8ee125ddcb7f6ddcef5d05",
      "summary_version": 0,
      "status": "pending",
      "summary_short": {
        "zh": ":books: Freely available programming books",
        "en": ":books: Freely available programming books",
        "es": ""
      },
      "tri_context": {
        "name": "free-programming-books",
        "url": "https://github.com/EbookFoundation/free-programming-books",
        "tags": [
          "books",
          "education",
          "hacktoberfest",
          "list",
          "resource"
        ],
        "stats": {
          "stars": 385839,
          "forks": 66113,
          "issues": 77
        },
        "metadata": {
          "license": "CC-BY-4.0",
          "lang": "Python",
          "categories": {
            "capabilities": [],
            "scenes": [],
            "lifecycle": []
          }
        }
      },
      "created_at": "2026-04-22T03:43:23.786Z",
      "updated_at": "2026-04-22T03:43:23.786Z"
    }
  ]
}
