{
  "schema_version": 1,
  "pipeline_version": "v6",
  "run_id": "daily-2025-12-26-20251226030426.-a4682bd4",
  "date": "2025-12-26",
  "source": "huggingface",
  "generated_at": "2025-12-26T03:04:26.245Z",
  "items": [
    {
      "canonical_id": "huggingface:sentence-transformers/all-MiniLM-L6-v2",
      "promptHash": "sha256:8ca19d098c0d5ea46046da1c9f3b1a75106bb839b2c9e9dd8eef54e1c97f811a",
      "summary_version": 0,
      "status": "pending",
      "summary_short": {
        "zh": "",
        "en": "",
        "es": ""
      },
      "tri_context": {
        "name": "all-MiniLM-L6-v2",
        "url": "https://huggingface.co/sentence-transformers/all-MiniLM-L6-v2",
        "tags": [
          "sentence-transformers",
          "pytorch",
          "tf",
          "rust",
          "onnx",
          "safetensors",
          "openvino",
          "bert",
          "feature-extraction",
          "sentence-similarity",
          "transformers",
          "en",
          "dataset:s2orc",
          "dataset:flax-sentence-embeddings/stackexchange_xml",
          "dataset:ms_marco",
          "dataset:gooaq",
          "dataset:yahoo_answers_topics",
          "dataset:code_search_net",
          "dataset:search_qa",
          "dataset:eli5",
          "dataset:snli",
          "dataset:multi_nli",
          "dataset:wikihow",
          "dataset:natural_questions",
          "dataset:trivia_qa",
          "dataset:embedding-data/sentence-compression",
          "dataset:embedding-data/flickr30k-captions",
          "dataset:embedding-data/altlex",
          "dataset:embedding-data/simple-wiki",
          "dataset:embedding-data/QQP",
          "dataset:embedding-data/SPECTER",
          "dataset:embedding-data/PAQ_pairs",
          "dataset:embedding-data/WikiAnswers",
          "arxiv:1904.06472",
          "arxiv:2102.07033",
          "arxiv:2104.08727",
          "arxiv:1704.05179",
          "arxiv:1810.09305",
          "license:apache-2.0",
          "text-embeddings-inference",
          "endpoints_compatible",
          "deploy:azure",
          "region:us"
        ],
        "stats": {
          "downloads_total": 148301778,
          "likes_total": 4260
        },
        "metadata": {
          "license": "N/A",
          "lang": "N/A",
          "categories": {
            "capabilities": [],
            "scenes": [],
            "lifecycle": []
          }
        },
        "description": ""
      },
      "created_at": "2025-12-26T03:04:26.245Z",
      "updated_at": "2025-12-26T03:04:26.245Z"
    },
    {
      "canonical_id": "huggingface:Falconsai/nsfw_image_detection",
      "promptHash": "sha256:354802ae608c3313fc45386430a7b7110156ab678d1f82b1e441c79857174bca",
      "summary_version": 0,
      "status": "pending",
      "summary_short": {
        "zh": "",
        "en": "",
        "es": ""
      },
      "tri_context": {
        "name": "nsfw_image_detection",
        "url": "https://huggingface.co/Falconsai/nsfw_image_detection",
        "tags": [
          "transformers",
          "pytorch",
          "safetensors",
          "vit",
          "image-classification",
          "arxiv:2010.11929",
          "license:apache-2.0",
          "endpoints_compatible",
          "region:us"
        ],
        "stats": {
          "downloads_total": 80382107,
          "likes_total": 925
        },
        "metadata": {
          "license": "N/A",
          "lang": "N/A",
          "categories": {
            "capabilities": [],
            "scenes": [],
            "lifecycle": []
          }
        },
        "description": ""
      },
      "created_at": "2025-12-26T03:04:26.245Z",
      "updated_at": "2025-12-26T03:04:26.245Z"
    },
    {
      "canonical_id": "huggingface:google/electra-base-discriminator",
      "promptHash": "sha256:b7a35829f521c4fdcddf87805ac9f16ebd258cc548173cdfb983730156ddf6b9",
      "summary_version": 0,
      "status": "pending",
      "summary_short": {
        "zh": "",
        "en": "",
        "es": ""
      },
      "tri_context": {
        "name": "electra-base-discriminator",
        "url": "https://huggingface.co/google/electra-base-discriminator",
        "tags": [
          "transformers",
          "pytorch",
          "tf",
          "jax",
          "rust",
          "electra",
          "pretraining",
          "en",
          "arxiv:1406.2661",
          "license:apache-2.0",
          "endpoints_compatible",
          "region:us"
        ],
        "stats": {
          "downloads_total": 60624723,
          "likes_total": 71
        },
        "metadata": {
          "license": "N/A",
          "lang": "N/A",
          "categories": {
            "capabilities": [],
            "scenes": [],
            "lifecycle": []
          }
        },
        "description": ""
      },
      "created_at": "2025-12-26T03:04:26.245Z",
      "updated_at": "2025-12-26T03:04:26.245Z"
    },
    {
      "canonical_id": "huggingface:google-bert/bert-base-uncased",
      "promptHash": "sha256:103bf1cded07197c1a0c664f6dcb115c0d0822e3d00b7dfad50034a8b7a28f29",
      "summary_version": 0,
      "status": "pending",
      "summary_short": {
        "zh": "",
        "en": "",
        "es": ""
      },
      "tri_context": {
        "name": "bert-base-uncased",
        "url": "https://huggingface.co/google-bert/bert-base-uncased",
        "tags": [
          "transformers",
          "pytorch",
          "tf",
          "jax",
          "rust",
          "coreml",
          "onnx",
          "safetensors",
          "bert",
          "fill-mask",
          "exbert",
          "en",
          "dataset:bookcorpus",
          "dataset:wikipedia",
          "arxiv:1810.04805",
          "license:apache-2.0",
          "endpoints_compatible",
          "deploy:azure",
          "region:us"
        ],
        "stats": {
          "downloads_total": 51826127,
          "likes_total": 2525
        },
        "metadata": {
          "license": "N/A",
          "lang": "N/A",
          "categories": {
            "capabilities": [],
            "scenes": [],
            "lifecycle": []
          }
        },
        "description": ""
      },
      "created_at": "2025-12-26T03:04:26.245Z",
      "updated_at": "2025-12-26T03:04:26.245Z"
    },
    {
      "canonical_id": "huggingface:dima806/fairface_age_image_detection",
      "promptHash": "sha256:d4ebed2fed33cd009380729ce8833b808d63b9f427e856535d0929ba5f9896f4",
      "summary_version": 0,
      "status": "pending",
      "summary_short": {
        "zh": "",
        "en": "",
        "es": ""
      },
      "tri_context": {
        "name": "fairface_age_image_detection",
        "url": "https://huggingface.co/dima806/fairface_age_image_detection",
        "tags": [
          "transformers",
          "safetensors",
          "vit",
          "image-classification",
          "dataset:nateraw/fairface",
          "base_model:google/vit-base-patch16-224-in21k",
          "base_model:finetune:google/vit-base-patch16-224-in21k",
          "license:apache-2.0",
          "autotrain_compatible",
          "endpoints_compatible",
          "region:us"
        ],
        "stats": {
          "downloads_total": 48983824,
          "likes_total": 54
        },
        "metadata": {
          "license": "N/A",
          "lang": "N/A",
          "categories": {
            "capabilities": [],
            "scenes": [],
            "lifecycle": []
          }
        },
        "description": ""
      },
      "created_at": "2025-12-26T03:04:26.245Z",
      "updated_at": "2025-12-26T03:04:26.245Z"
    }
  ]
}
