{
  "schema_version": 1,
  "pipeline_version": "v6",
  "run_id": "daily-2025-10-13-20251013025816.-7052bdfa",
  "date": "2025-10-13",
  "source": "huggingface",
  "generated_at": "2025-10-13T02:58:17.275Z",
  "items": [
    {
      "canonical_id": "huggingface:Salesforce/blip-image-captioning-base",
      "promptHash": "sha256:41691c166cdc559b316d85015f6aff9ab1bddda9de8f5914942dbafcbf5f6bff",
      "summary_version": 0,
      "status": "pending",
      "summary_short": {
        "zh": "",
        "en": "",
        "es": ""
      },
      "tri_context": {
        "name": "blip-image-captioning-base",
        "url": "https://huggingface.co/Salesforce/blip-image-captioning-base",
        "tags": [
          "transformers",
          "pytorch",
          "tf",
          "blip",
          "image-to-text",
          "image-captioning",
          "arxiv:2201.12086",
          "license:bsd-3-clause",
          "endpoints_compatible",
          "region:us"
        ],
        "stats": {
          "downloads_total": 1853978,
          "likes_total": 789
        },
        "metadata": {
          "license": "N/A",
          "lang": "N/A",
          "categories": {
            "capabilities": [],
            "scenes": [],
            "lifecycle": []
          }
        },
        "description": ""
      },
      "created_at": "2025-10-13T02:58:17.275Z",
      "updated_at": "2025-10-13T02:58:17.275Z"
    },
    {
      "canonical_id": "huggingface:Qwen/Qwen2-VL-7B-Instruct",
      "promptHash": "sha256:67106fd1cc2adc139bf3058988983aff541c2645eb0629ea5b5199d007b66ea6",
      "summary_version": 0,
      "status": "pending",
      "summary_short": {
        "zh": "",
        "en": "",
        "es": ""
      },
      "tri_context": {
        "name": "Qwen2-VL-7B-Instruct",
        "url": "https://huggingface.co/Qwen/Qwen2-VL-7B-Instruct",
        "tags": [
          "transformers",
          "safetensors",
          "qwen2_vl",
          "image-to-text",
          "multimodal",
          "image-text-to-text",
          "conversational",
          "en",
          "arxiv:2409.12191",
          "arxiv:2308.12966",
          "base_model:Qwen/Qwen2-VL-7B",
          "base_model:finetune:Qwen/Qwen2-VL-7B",
          "license:apache-2.0",
          "text-generation-inference",
          "endpoints_compatible",
          "region:us"
        ],
        "stats": {
          "downloads_total": 1852689,
          "likes_total": 1231
        },
        "metadata": {
          "license": "N/A",
          "lang": "N/A",
          "categories": {
            "capabilities": [],
            "scenes": [],
            "lifecycle": []
          }
        },
        "description": ""
      },
      "created_at": "2025-10-13T02:58:17.275Z",
      "updated_at": "2025-10-13T02:58:17.275Z"
    }
  ]
}
