{
  "schema_version": 1,
  "pipeline_version": "v6",
  "run_id": "data-analysis-2025-10-12-20251012025303.-9f31189e",
  "date": "2025-10-12",
  "source": "github",
  "generated_at": "2025-10-12T02:53:03.532Z",
  "items": [
    {
      "canonical_id": "github:thedaviddias/Front-End-Checklist",
      "promptHash": "sha256:c0991cf12afb59be3afae829c902d2b30d1991bcdeb325efc219b841c6f2188e",
      "summary_version": 0,
      "status": "pending",
      "summary_short": {
        "zh": "🗂 The perfect Front-End Checklist for modern websites and meticulous developers",
        "en": "🗂 The perfect Front-End Checklist for modern websites and meticulous developers",
        "es": ""
      },
      "tri_context": {
        "name": "Front-End-Checklist",
        "url": "https://github.com/thedaviddias/Front-End-Checklist",
        "tags": [
          "checklist",
          "css",
          "front-end-developer-tool",
          "front-end-development",
          "frontend",
          "guidelines",
          "html",
          "javascript",
          "lists",
          "reference",
          "resources",
          "web-development"
        ],
        "stats": {
          "stars": 71495,
          "forks": 6590,
          "issues": 2
        },
        "metadata": {
          "license": "CC0-1.0",
          "lang": "N/A",
          "categories": {
            "capabilities": [],
            "scenes": [],
            "lifecycle": []
          }
        }
      },
      "created_at": "2025-10-12T02:51:52.704Z",
      "updated_at": "2025-10-12T02:51:52.704Z"
    }
  ]
}
