{
  "schema_version": 1,
  "pipeline_version": "v6",
  "run_id": "daily-2026-03-08-20260308032448.-217053d5",
  "date": "2026-03-08",
  "source": "huggingface",
  "generated_at": "2026-03-08T03:24:48.811Z",
  "items": [
    {
      "canonical_id": "huggingface:sentence-transformers/all-MiniLM-L6-v2",
      "promptHash": "sha256:8ca19d098c0d5ea46046da1c9f3b1a75106bb839b2c9e9dd8eef54e1c97f811a",
      "summary_version": 0,
      "status": "pending",
      "summary_short": {
        "zh": "",
        "en": "",
        "es": ""
      },
      "tri_context": {
        "name": "all-MiniLM-L6-v2",
        "url": "https://huggingface.co/sentence-transformers/all-MiniLM-L6-v2",
        "tags": [
          "sentence-transformers",
          "pytorch",
          "tf",
          "rust",
          "onnx",
          "safetensors",
          "openvino",
          "bert",
          "feature-extraction",
          "sentence-similarity",
          "transformers",
          "en",
          "dataset:s2orc",
          "dataset:flax-sentence-embeddings/stackexchange_xml",
          "dataset:ms_marco",
          "dataset:gooaq",
          "dataset:yahoo_answers_topics",
          "dataset:code_search_net",
          "dataset:search_qa",
          "dataset:eli5",
          "dataset:snli",
          "dataset:multi_nli",
          "dataset:wikihow",
          "dataset:natural_questions",
          "dataset:trivia_qa",
          "dataset:embedding-data/sentence-compression",
          "dataset:embedding-data/flickr30k-captions",
          "dataset:embedding-data/altlex",
          "dataset:embedding-data/simple-wiki",
          "dataset:embedding-data/QQP",
          "dataset:embedding-data/SPECTER",
          "dataset:embedding-data/PAQ_pairs",
          "dataset:embedding-data/WikiAnswers",
          "arxiv:1904.06472",
          "arxiv:2102.07033",
          "arxiv:2104.08727",
          "arxiv:1704.05179",
          "arxiv:1810.09305",
          "license:apache-2.0",
          "eval-results",
          "text-embeddings-inference",
          "endpoints_compatible",
          "deploy:azure",
          "region:us"
        ],
        "stats": {
          "downloads_total": 199768964,
          "likes_total": 4546
        },
        "metadata": {
          "license": "N/A",
          "lang": "N/A",
          "categories": {
            "capabilities": [],
            "scenes": [],
            "lifecycle": []
          }
        },
        "description": ""
      },
      "created_at": "2026-03-08T03:24:48.811Z",
      "updated_at": "2026-03-08T03:24:48.811Z"
    },
    {
      "canonical_id": "huggingface:google-bert/bert-base-uncased",
      "promptHash": "sha256:103bf1cded07197c1a0c664f6dcb115c0d0822e3d00b7dfad50034a8b7a28f29",
      "summary_version": 0,
      "status": "pending",
      "summary_short": {
        "zh": "",
        "en": "",
        "es": ""
      },
      "tri_context": {
        "name": "bert-base-uncased",
        "url": "https://huggingface.co/google-bert/bert-base-uncased",
        "tags": [
          "transformers",
          "pytorch",
          "tf",
          "jax",
          "rust",
          "coreml",
          "onnx",
          "safetensors",
          "bert",
          "fill-mask",
          "exbert",
          "en",
          "dataset:bookcorpus",
          "dataset:wikipedia",
          "arxiv:1810.04805",
          "license:apache-2.0",
          "endpoints_compatible",
          "deploy:azure",
          "region:us"
        ],
        "stats": {
          "downloads_total": 66645085,
          "likes_total": 2582
        },
        "metadata": {
          "license": "N/A",
          "lang": "N/A",
          "categories": {
            "capabilities": [],
            "scenes": [],
            "lifecycle": []
          }
        },
        "description": ""
      },
      "created_at": "2026-03-08T03:24:48.811Z",
      "updated_at": "2026-03-08T03:24:48.811Z"
    },
    {
      "canonical_id": "huggingface:google/electra-base-discriminator",
      "promptHash": "sha256:b7a35829f521c4fdcddf87805ac9f16ebd258cc548173cdfb983730156ddf6b9",
      "summary_version": 0,
      "status": "pending",
      "summary_short": {
        "zh": "",
        "en": "",
        "es": ""
      },
      "tri_context": {
        "name": "electra-base-discriminator",
        "url": "https://huggingface.co/google/electra-base-discriminator",
        "tags": [
          "transformers",
          "pytorch",
          "tf",
          "jax",
          "rust",
          "electra",
          "pretraining",
          "en",
          "arxiv:1406.2661",
          "license:apache-2.0",
          "endpoints_compatible",
          "region:us"
        ],
        "stats": {
          "downloads_total": 47947508,
          "likes_total": 83
        },
        "metadata": {
          "license": "N/A",
          "lang": "N/A",
          "categories": {
            "capabilities": [],
            "scenes": [],
            "lifecycle": []
          }
        },
        "description": ""
      },
      "created_at": "2026-03-08T03:24:48.811Z",
      "updated_at": "2026-03-08T03:24:48.811Z"
    },
    {
      "canonical_id": "huggingface:Falconsai/nsfw_image_detection",
      "promptHash": "sha256:99eb3455f132a5daa0b74321d39efa65c6809414abe9e770c4103364cd72c767",
      "summary_version": 0,
      "status": "pending",
      "summary_short": {
        "zh": "",
        "en": "",
        "es": ""
      },
      "tri_context": {
        "name": "nsfw_image_detection",
        "url": "https://huggingface.co/Falconsai/nsfw_image_detection",
        "tags": [
          "transformers",
          "pytorch",
          "safetensors",
          "vit",
          "image-classification",
          "arxiv:2010.11929",
          "license:apache-2.0",
          "endpoints_compatible",
          "deploy:azure",
          "region:us"
        ],
        "stats": {
          "downloads_total": 41588106,
          "likes_total": 1006
        },
        "metadata": {
          "license": "N/A",
          "lang": "N/A",
          "categories": {
            "capabilities": [],
            "scenes": [],
            "lifecycle": []
          }
        },
        "description": ""
      },
      "created_at": "2026-03-08T03:24:48.811Z",
      "updated_at": "2026-03-08T03:24:48.811Z"
    },
    {
      "canonical_id": "huggingface:sentence-transformers/all-mpnet-base-v2",
      "promptHash": "sha256:e001b68a1a1977c209e5cf12e683c2eb389f3a9e8445b7e17182f439cf103c9d",
      "summary_version": 0,
      "status": "pending",
      "summary_short": {
        "zh": "",
        "en": "",
        "es": ""
      },
      "tri_context": {
        "name": "all-mpnet-base-v2",
        "url": "https://huggingface.co/sentence-transformers/all-mpnet-base-v2",
        "tags": [
          "sentence-transformers",
          "pytorch",
          "onnx",
          "safetensors",
          "openvino",
          "mpnet",
          "fill-mask",
          "feature-extraction",
          "sentence-similarity",
          "transformers",
          "text-embeddings-inference",
          "en",
          "dataset:s2orc",
          "dataset:flax-sentence-embeddings/stackexchange_xml",
          "dataset:ms_marco",
          "dataset:gooaq",
          "dataset:yahoo_answers_topics",
          "dataset:code_search_net",
          "dataset:search_qa",
          "dataset:eli5",
          "dataset:snli",
          "dataset:multi_nli",
          "dataset:wikihow",
          "dataset:natural_questions",
          "dataset:trivia_qa",
          "dataset:embedding-data/sentence-compression",
          "dataset:embedding-data/flickr30k-captions",
          "dataset:embedding-data/altlex",
          "dataset:embedding-data/simple-wiki",
          "dataset:embedding-data/QQP",
          "dataset:embedding-data/SPECTER",
          "dataset:embedding-data/PAQ_pairs",
          "dataset:embedding-data/WikiAnswers",
          "arxiv:1904.06472",
          "arxiv:2102.07033",
          "arxiv:2104.08727",
          "arxiv:1704.05179",
          "arxiv:1810.09305",
          "license:apache-2.0",
          "endpoints_compatible",
          "deploy:azure",
          "region:us"
        ],
        "stats": {
          "downloads_total": 27780304,
          "likes_total": 1253
        },
        "metadata": {
          "license": "N/A",
          "lang": "N/A",
          "categories": {
            "capabilities": [],
            "scenes": [],
            "lifecycle": []
          }
        },
        "description": ""
      },
      "created_at": "2026-03-08T03:24:48.811Z",
      "updated_at": "2026-03-08T03:24:48.811Z"
    },
    {
      "canonical_id": "huggingface:timm/convnext_base.clip_laion2b",
      "promptHash": "sha256:338b713968510fff18161728cbe0eda17632c59c02ce8db47089ae776f6a5b24",
      "summary_version": 0,
      "status": "pending",
      "summary_short": {
        "zh": "",
        "en": "",
        "es": ""
      },
      "tri_context": {
        "name": "convnext_base.clip_laion2b",
        "url": "https://huggingface.co/timm/convnext_base.clip_laion2b",
        "tags": [
          "timm",
          "pytorch",
          "safetensors",
          "image-feature-extraction",
          "transformers",
          "license:apache-2.0",
          "region:us"
        ],
        "stats": {
          "downloads_total": 2946685,
          "likes_total": 0
        },
        "metadata": {
          "license": "N/A",
          "lang": "N/A",
          "categories": {
            "capabilities": [],
            "scenes": [],
            "lifecycle": []
          }
        },
        "description": ""
      },
      "created_at": "2026-03-08T03:24:48.811Z",
      "updated_at": "2026-03-08T03:24:48.811Z"
    }
  ]
}
