{
  "schema_version": 1,
  "pipeline_version": "v6",
  "run_id": "data-analysis-2026-05-14-20260514040102.-9595ae1e",
  "date": "2026-05-14",
  "source": "github",
  "generated_at": "2026-05-14T04:01:02.071Z",
  "items": [
    {
      "canonical_id": "github:obra/superpowers",
      "promptHash": "sha256:2ecb10e3bc6e2683a79fc1849d924280e7606fea7342eedd167ee77364665278",
      "summary_version": 0,
      "status": "pending",
      "summary_short": {
        "zh": "An agentic skills framework & software development methodology that works.",
        "en": "An agentic skills framework & software development methodology that works.",
        "es": ""
      },
      "tri_context": {
        "name": "superpowers",
        "url": "https://github.com/obra/superpowers",
        "tags": [],
        "stats": {
          "stars": 189798,
          "forks": 16896,
          "issues": 265
        },
        "metadata": {
          "license": "MIT",
          "lang": "Shell",
          "categories": {
            "capabilities": [],
            "scenes": [],
            "lifecycle": []
          }
        }
      },
      "created_at": "2026-05-14T03:48:52.266Z",
      "updated_at": "2026-05-14T03:48:52.266Z"
    },
    {
      "canonical_id": "github:sindresorhus/awesome",
      "promptHash": "sha256:2724fb8aae725474927df4f6b45de69bae28d10fbcf1a45f9da35c228ebe25de",
      "summary_version": 0,
      "status": "pending",
      "summary_short": {
        "zh": "😎 Awesome lists about all kinds of interesting topics",
        "en": "😎 Awesome lists about all kinds of interesting topics",
        "es": ""
      },
      "tri_context": {
        "name": "awesome",
        "url": "https://github.com/sindresorhus/awesome",
        "tags": [
          "awesome",
          "awesome-list",
          "lists",
          "resources",
          "unicorns"
        ],
        "stats": {
          "stars": 466073,
          "forks": 34963,
          "issues": 75
        },
        "metadata": {
          "license": "CC0-1.0",
          "lang": "N/A",
          "categories": {
            "capabilities": [],
            "scenes": [],
            "lifecycle": []
          }
        }
      },
      "created_at": "2026-05-14T03:48:52.266Z",
      "updated_at": "2026-05-14T03:48:52.266Z"
    },
    {
      "canonical_id": "github:freeCodeCamp/freeCodeCamp",
      "promptHash": "sha256:7ce99892d88148e7d5cae0b4fc07936e1c16cb26ec455fb4ce856749a954c941",
      "summary_version": 0,
      "status": "pending",
      "summary_short": {
        "zh": "freeCodeCamp.org's open-source codebase and curriculum. Learn math, programming, and computer science for free.",
        "en": "freeCodeCamp.org's open-source codebase and curriculum. Learn math, programming, and computer science for free.",
        "es": ""
      },
      "tri_context": {
        "name": "freeCodeCamp",
        "url": "https://github.com/freeCodeCamp/freeCodeCamp",
        "tags": [
          "careers",
          "certification",
          "community",
          "curriculum",
          "d3",
          "education",
          "freecodecamp",
          "javascript",
          "learn-to-code",
          "math",
          "nodejs",
          "nonprofits",
          "programming",
          "react",
          "teachers"
        ],
        "stats": {
          "stars": 444653,
          "forks": 44545,
          "issues": 190
        },
        "metadata": {
          "license": "BSD-3-Clause",
          "lang": "TypeScript",
          "categories": {
            "capabilities": [],
            "scenes": [],
            "lifecycle": []
          }
        }
      },
      "created_at": "2026-05-14T03:48:52.266Z",
      "updated_at": "2026-05-14T03:48:52.266Z"
    }
  ]
}
